1	it 's a spectacular performance ahem , we hope it 's only acting
0	the film 's considered approach to its subject matter is too calm and thoughtful for agitprop , and the thinness of its characterizations makes it a failure as straight drama '
1	symbolically , warm water under a red bridge is a celebration of feminine energy , a tribute to the power of women to heal
1	you come away from his film overwhelmed , hopeful and , perhaps paradoxically , illuminated
0	equlibrium could pass for a thirteen year old 's book report on the totalitarian themes of 1984 and farenheit 451
1	a film of delicate interpersonal dances
1	lrb westbrook rrb makes a wonderful subject for the camera
1	cusack 's just brilliant in this
1	what a bewilderingly brilliant and entertaining movie this is
1	never lets go your emotions , taking them to surprising highs , sorrowful lows and hidden impulsive niches gorgeous , passionate , and at times uncommonly moving
1	few films have captured the chaos of an urban conflagration with such fury , and audience members will leave feeling as shaken as nesbitt 's cooper looks when the bullets stop flying
1	ferrara 's best film in years
0	we have poignancy jostling against farce , thoughtful dialogue elbowed aside by one liners , and a visual style that incorporates rotoscope animation for no apparent reason except , maybe , that it looks neat
1	watching war photographer , you come to believe that nachtwey hates the wars he shows and empathizes with the victims he reveals
0	you 'd be hard put to find a movie character more unattractive or odorous lrb than leon rrb
0	what soured me on the santa clause 2 was that santa bumps up against 21st century reality so hard , it 's icky
1	ash wednesday is not edward burns ' best film , but it is a good and ambitious film
0	the lead actors share no chemistry or engaging charisma
0	ms phoenix is completely lacking in charm and charisma , and is unable to project either esther 's initial anomie or her eventual awakening
0	when not wallowing in its characters ' frustrations , the movie is busy contriving false , sitcom worthy solutions to their problems
1	polished , well structured film
0	the laughs are as rare as snake foo yung
1	an eloquent , reflective and beautifully acted meditation on both the profoundly devastating events of one year ago and the slow , painful healing process that has followed in their wake
0	but there 's plenty to offend everyone
0	after that it becomes long and tedious like a classroom play in a college history course
1	an exceptionally acted , quietly affecting cop drama
1	one of the best films i have ever seen , constantly pulling the rug from underneath us , seeing things from new sides , plunging deeper , getting more intense
0	stitch is a bad mannered , ugly and destructive little
1	an intelligently made lrb and beautifully edited rrb picture that at the very least has a spark of life to it more than you can say for plenty of movies that flow through the hollywood pipeline without a hitch
1	charlie hunnam has the twinkling eyes , repressed smile and determined face needed to carry out a dickensian hero
0	what should have been a painless time killer becomes instead a grating endurance test
0	the film has lrb its rrb moments , but they are few and far between
0	if religious films are n't your bailiwick , stay away
1	this enthralling documentary is at once playful and haunting , an in depth portrait of an iconoclastic artist who was fundamentally unknowable even to his closest friends
1	a wild , endearing , masterful documentary
1	a dreadful day in irish history is given passionate , if somewhat flawed , treatment
0	the april 2002 instalment of the american war for independence , complete with loads of cgi and bushels of violence , but not a drop of human blood
0	if there was any doubt that peter o'fallon did n't have an original bone in his body , a rumor of angels should dispel it
0	there is something in full frontal , i guess , about artifice and acting and how it distorts reality for people who make movies and watch them , but like most movie riddles , it works only if you have an interest in the characters you see
0	a minor league soccer remake of the longest yard
0	` it 's painful to watch witherspoon 's talents wasting away inside unnecessary films like legally blonde and sweet home abomination , i mean , alabama '
1	it 's absolutely amazing how first time director kevin donovan managed to find something new to add to the canon of chan
1	it 's as raw and action packed an experience as a ringside seat at a tough man contest
0	to me , it sounds like a cruel deception carried out by men of marginal intelligence , with reactionary ideas about women and a total lack of empathy
1	you wo n't have any trouble getting kids to eat up these veggies
0	too bland and fustily tasteful to be truly prurient
0	it does n't work as either
0	this one aims for the toilet and scores a direct hit
0	in the name of an allegedly inspiring and easily marketable flick , the emperor 's club turns a blind eye to the very history it pretends to teach
0	the movie is undone by a filmmaking methodology that 's just experimental enough to alienate the mainstream audience while ringing cliched to hardened indie heads
1	two tedious acts light on great scares and a good surprise ending
1	and your reward will be a thoughtful , emotional movie experience
0	obvious
1	`` birthday girl '' is an actor 's movie first and foremost
1	the little girls understand , and mccracken knows that 's all that matters
0	the pacing is often way off and there are too many bona fide groaners among too few laughs
1	i liked it because it was so endlessly , grotesquely , inventive
1	that , in itself , is extraordinary
1	yes
1	k 19 the widowmaker is a great yarn
1	and educational !
1	an undeniably moving film to experience , and ultimately that 's what makes it worth a recommendation
1	confessions is n't always coherent , but it 's sharply comic and surprisingly touching , so hold the gong
0	the film has the thrown together feel of a summer camp talent show hastily written , underrehearsed , arbitrarily plotted and filled with crude humor and vulgar innuendo
1	sharp edges and a deep vein of sadness run through its otherwise comic narrative
1	crush is so warm and fuzzy you might be able to forgive its mean spirited second half
0	strong filmmaking requires a clear sense of purpose , and in that oh so important category , the four feathers comes up short
1	the best didacticism is one carried by a strong sense of humanism , and bertrand tavernier 's oft brilliant safe conduct lrb `` laissez passer '' rrb wears its heart on its sleeve
0	i have returned from the beyond to warn you this movie is 90 minutes long , and life is too short
1	despite lagging near the finish line , the movie runs a good race , one that will have you at the edge of your seat for long stretches '
1	witty and often surprising , a dark little morality tale disguised as a romantic comedy
0	they 're the unnamed , easily substitutable forces that serve as whatever terror the heroes of horror movies try to avoid
1	watching these eccentrics is both inspiring and pure joy
0	spain 's greatest star wattage does n't overcome the tumult of maudlin tragedy
0	director jay russell stomps in hobnail boots over natalie babbitt 's gentle , endearing 1975 children 's novel
1	colorful , energetic and sweetly whimsical the rare sequel that 's better than its predecessor
0	a pretentious and ultimately empty examination of a sick and evil woman
1	a small movie with a big heart
1	maggie g makes an amazing breakthrough in her first starring role and eats up the screen
0	most of the movie is so deadly dull that watching the proverbial paint dry would be a welcome improvement
1	lrb the cockettes rrb provides a window into a subculture hell bent on expressing itself in every way imaginable '
1	most thrillers send audiences out talking about specific scary scenes or startling moments `` frailty '' leaves us with the terrifying message that the real horror may be waiting for us at home
1	the difference between cho and most comics is that her confidence in her material is merited
0	this remake of lina wertmuller 's 1975 eroti comedy might just be the biggest husband and wife disaster since john and bo derek made the ridiculous bolero
0	lrb a rrb poorly executed comedy
1	holland lets things peter out midway , but it 's notably better acted and far less crass than some other recent efforts in the burgeoning genre of films about black urban professionals
1	rogers 's mouth never stops shut about the war between the sexes and how to win the battle
1	lawrence plumbs personal tragedy and also the human comedy
1	maintains your sympathy for this otherwise challenging soul by letting you share her one room world for a while
1	tends to pile too many `` serious issues '' on its plate at times , yet remains fairly light , always entertaining , and smartly written
1	an inventive , absorbing movie that 's as hard to classify as it is hard to resist
1	lrb russell rrb makes good b movies lrb the mask , the blob rrb , and the scorpion king more than ably meets those standards
0	what little grace lrb rifkin 's rrb tale of precarious skid row dignity achieves is pushed into the margins by predictable plotting and tiresome histrionics
1	the last scenes of the film are anguished , bitter and truthful
0	however sincere it may be , the rising place never quite justifies its own existence
0	the whole thing feels like a ruse , a tactic to cover up the fact that the picture is constructed around a core of flimsy or , worse yet , nonexistent ideas
0	supposedly authentic account of a historical event that 's far too tragic to merit such superficial treatment
0	no laughs
1	but the actors make this worth a peek
1	a gem of a movie
0	the whole thing plays like a tired tyco ad
0	it 's exactly the kind of movie toback 's detractors always accuse him of making
1	mr clooney , mr kaufman and all their collaborators are entitled to take a deep bow for fashioning an engrossing entertainment out of an almost sure fire prescription for a critical and commercial disaster
0	it would be churlish to begrudge anyone for receiving whatever consolation that can be found in dragonfly , yet it is impossible to find the film anything but appalling , shamelessly manipulative and contrived , and totally lacking in conviction
0	both deserve better
1	between them , de niro and murphy make showtime the most savory and hilarious guilty pleasure of many a recent movie season
1	upsetting and thought provoking , the film has an odd purity that does n't bring you into the characters so much as it has you study them
0	slap me , i saw this movie
1	visually , ` santa clause 2 ' is wondrously creative
1	a coming of age tale from new zealand whose boozy , languid air is balanced by a rich visual clarity and deeply felt performances across the board
1	` it 's better to go in knowing full well what 's going to happen , but willing to let the earnestness of its execution and skill of its cast take you down a familiar road with a few twists
1	a portrait of hell so shattering it 's impossible to shake
0	hopelessly inane , humorless and under inspired
0	bogdanich is unashamedly pro serbian and makes little attempt to give voice to the other side
0	like a pack of dynamite sticks , built for controversy
1	take any 12 year old boy to see this picture , and he 'll be your slave for a year
1	miyazaki 's nonstop images are so stunning , and his imagination so vivid , that the only possible complaint you could have about spirited away is that there is no rest period , no timeout
1	stage director sam mendes showcases tom hanks as a depression era hit man in this dark tale of revenge
1	veret has a whip smart sense of narrative bluffs
0	ponderous , plodding soap opera disguised as a feature film
0	gets the look and the period trappings right , but it otherwise drowns in a sea of visual and verbal clich s
1	director roger kumble offers just enough sweet and traditional romantic comedy to counter the crudity
1	a bittersweet contemporary comedy about benevolent deception , which , while it may not rival the filmmaker 's period pieces , is still very much worth seeing
0	gorgeous to look at but insufferably tedious and turgid a curiously constricted epic
0	then again , in a better movie , you might not have noticed
1	a fairly enjoyable mixture of longest yard and the 1999 guy ritchie caper lock stock and two smoking barrels
0	the re enactments , however fascinating they may be as history , are too crude to serve the work especially well
1	if a horror movie 's primary goal is to frighten and disturb , then they works spectacularly well a shiver inducing , nerve rattling ride
0	oedekerk mugs mercilessly , and the genuinely funny jokes are few and far between
0	often silly and gross but it 's rarely as moronic as some campus gross out films
1	spielberg 's first real masterpiece , it deserved all the hearts it won and wins still , 20 years later
0	unlike lrb scorsese 's mean streets rrb , ash wednesday is essentially devoid of interesting characters or even a halfway intriguing plot
1	you may feel compelled to watch the film twice or pick up a book on the subject
1	slow and ponderous , but rohmer 's drama builds to an intense indoor drama about compassion , sacrifice , and christian love in the face of political corruption
0	sheridan 's take on the author 's schoolboy memoir is a rather toothless take on a hard young life
1	godard has never made a more sheerly beautiful film than this unexpectedly moving meditation on love , history , memory , resistance and artistic transcendence
0	under rehearsed and lifeless
1	the film offers an intriguing what if premise
0	this 10th film in the series looks and feels tired
1	you need n't be steeped in '50s sociology , pop culture or movie lore to appreciate the emotional depth of haynes ' work
1	rarely have i seen a film so willing to champion the fallibility of the human heart
1	a witty , low key romantic comedy
1	what enlivens this film , beyond the astute direction of cardoso and beautifully detailed performances by all of the actors , is a note of defiance over social dictates
1	a delightful little film that revels in its own simplicity , mostly martha will leave you with a smile on your face and a grumble in your stomach
1	it 's hard to quibble with a flick boasting this many genuine cackles , but notorious c h o still feels like a promising work in progress
0	a shoddy male hip hop fantasy filled with guns , expensive cars , lots of naked women and rocawear clothing
1	a strong and confident work which works so well for the first 89 minutes , but ends so horrendously confusing in the final two
0	even the hastily and amateurishly drawn animation can not engage
1	with ` bowling for columbine , ' michael moore gives us the perfect starting point for a national conversation about guns , violence , and fear
1	i liked it just enough
1	it 's the funniest american comedy since graffiti bridge
1	after an uncertain start , murder hits and generally sustains a higher plateau with bullock 's memorable first interrogation of gosling
1	although devoid of objectivity and full of nostalgic comments from the now middle aged participants , dogtown and z boys has a compelling story to tell
1	a delicious crime drama on par with the slickest of mamet
0	on top of a foundering performance , lrb madonna 's rrb denied her own athleticism by lighting that emphasizes every line and sag
1	on the surface a silly comedy , scotland , pa would be forgettable if it were n't such a clever adaptation of the bard 's tragic play
1	mostly works because of the universal themes , earnest performances and excellent use of music by india 's popular gulzar and jagjit singh
0	about the only thing to give the movie points for is bravado to take an entirely stale concept and push it through the audience 's meat grinder one more time
1	but the performances of pacino , williams , and swank keep the viewer wide awake all the way through
0	a boring , pretentious muddle that uses a sensational , real life 19th century crime as a metaphor for well , i 'm not exactly sure what and has all the dramatic weight of a raindrop
1	far from heaven is a dazzling conceptual feat , but more than that , it 's a work of enthralling drama
1	blessed with a searing lead performance by ryan gosling lrb murder by numbers rrb , the movie is powerful and provocative
0	the film desperately sinks further and further into comedy futility
0	it almost feels as if the movie is more interested in entertaining itself than in amusing us
0	a low rent retread of the alien pictures
0	it merely indulges in the worst elements of all of them
1	there 's none of the happily ever after spangle of monsoon wedding in late marriage and that 's part of what makes dover kosashvili 's outstanding feature debut so potent
0	the entire film is one big excuse to play one lewd scene after another
1	a fascinating examination of the joyous , turbulent self discovery made by a proper , middle aged woman
1	has an unmistakable , easy joie de vivre
1	it 's a rare window on an artistic collaboration
0	report card does n't live up to the exalted tagline there 's definite room for improvement
0	too intensely focused on the travails of being hal hartley to function as pastiche , no such thing is hartley 's least accessible screed yet
1	a backstage must see for true fans of comedy
0	it 's got the brawn , but not the brains
0	lacks dramatic punch and depth
1	it may be a no brainer , but at least it 's a funny no brainer
0	like the excruciating end of days , collateral damage presents schwarzenegger as a tragic figure , but sympathy really belongs with any viewer forced to watch him try out so many complicated facial expressions
1	a great cast and a wonderful but sometimes confusing flashback movie about growing up in a dysfunctional family
0	ozpetek offers an aids subtext , skims over the realities of gay sex , and presents yet another tired old vision of the gay community as an all inclusive world where uptight , middle class bores like antonia can feel good about themselves
0	the leads are so unmemorable , despite several attempts at lengthy dialogue scenes , that one eventually resents having to inhale this gutter romancer 's secondhand material
0	a relative letdown
0	from its nauseating spinning credits sequence to a very talented but underutilized supporting cast , bartleby squanders as much as it gives out
1	a realistically terrifying movie that puts another notch in the belt of the long list of renegade cop tales
1	brings an irresistible blend of warmth and humor and a consistent embracing humanity in the face of life 's harshness
0	inconsequential road and buddy pic
0	it 's been 13 months and 295 preview screenings since i last walked out on a movie , but resident evil really earned my indignant , preemptive departure
1	the leanest and meanest of solondz 's misanthropic comedies
1	about schmidt belongs to nicholson
1	its metaphors are opaque enough to avoid didacticism , and the film succeeds as an emotionally accessible , almost mystical work
0	starts as an intense political and psychological thriller but is sabotaged by ticking time bombs and other hollywood action cliches
1	even if it pushes its agenda too forcefully , this remains a film about something , one that attempts and often achieves a level of connection and concern
0	the film is grossly contradictory in conveying its social message , if indeed there is one
1	daringly perceptive , taut , piercing and feisty , biggie and tupac is undeniably subversive and involving in its bold presentation
0	boyd 's screenplay lrb co written with guardian hack nick davies rrb has a florid turn of phrase that owes more to guy ritchie than the bard of avon
1	not about scares but a mood in which an ominous , pervasive , and unknown threat lurks just below the proceedings and adds an almost constant mindset of suspense
1	this deeply spiritual film taps into the meaning and consolation in afterlife communications
1	i know that i 'll never listen to marvin gaye or the supremes the same way again
0	a big , loud , bang the drum bore
0	horrendously amateurish filmmaking that is plainly dull and visually ugly when it is n't incomprehensible
0	after collateral damage , you might imagine that most every aggrieved father clich has been unturned
1	predictable storyline and by the book scripting is all but washed away by sumptuous ocean visuals and the cinematic stylings of director john stockwell
1	laugh out loud lines , adorably ditsy but heartfelt performances , and sparkling , bittersweet dialogue that cuts to the chase of the modern girl 's dilemma
1	essentially a collection of bits and they 're all naughty
0	you get the impression that writer and director burr steers knows the territory but his sense of humor has yet to lose the smug self satisfaction usually associated with the better private schools
1	ultimately engages less for its story of actorly existential despair than for its boundary hopping formal innovations and glimpse into another kind of chinese ` cultural revolution '
1	happily , some things are immune to the folly of changing taste and attitude
0	viewers will need all the luck they can muster just figuring out who 's who in this pretentious mess
1	the viewer takes great pleasure in watching the resourceful molly stay a step ahead of her pursuers
1	with we were soldiers , hollywood makes a valiant attempt to tell a story about the vietnam war before the pathology set in
0	i just saw this movie well , it 's probably not accurate to call it a movie
1	one of the smarter offerings the horror genre has produced in recent memory , even if it 's far tamer than advertised
1	a well done film of a self reflexive , philosophical nature
0	still , it just sits there like a side dish no one ordered
1	filmmakers dana janklowicz mann and amir mann area headed east , far east , in retelling a historically significant , and personal , episode detailing how one international city welcomed tens of thousands of german jewish refugees while the world 's democracie
0	who , exactly , is fighting whom here ?
0	can be as tiresome as 9 seconds of jesse helms ' anti castro rhetoric , which are included
0	it 's a lot to ask people to sit still for two hours and change watching such a character , especially when rendered in as flat and impassive a manner as phoenix 's
0	in truth , it has all the heart of a porno flick lrb but none of the sheer lust rrb
0	cherish would 've worked a lot better had it been a short film
1	if you 're looking for an intelligent movie in which you can release your pent up anger , enough is just the ticket you need
0	maybe there 's a metaphor here , but figuring it out would n't make trouble every day any better
0	a zippy 96 minutes of mediocre special effects , hoary dialogue , fluxing accents , and worst of all silly looking morlocks
0	every so often a film comes along that is so insanely stupid , so awful in so many ways that watching it leaves you giddy
1	but it is entertaining on an inferior level
1	plummer steals the show without resorting to camp as nicholas ' wounded and wounding uncle ralph
0	evokes the frustration , the awkwardness and the euphoria of growing up , without relying on the usual tropes
1	it 's a head turner thoughtfully written , beautifully read and , finally , deeply humanizing
0	as it is , it 's too long and unfocused
0	this is not a classical dramatic animated feature , nor a hip , contemporary , in jokey one
1	i 'm not a fan of the phrase ` life affirming ' because it usually means ` schmaltzy , ' but real women have curves truly is life affirming
0	too much of storytelling moves away from solondz 's social critique , casting its audience as that of intellectual lector in contemplation of the auteur 's professional injuries
1	charlotte sometimes is a gem
1	australia land beyond time is an enjoyable big movie primarily because australia is a weirdly beautiful place
1	as immaculate as stuart little 2 is , it could be a lot better if it were , well , more adventurous
0	further sad evidence that tom tykwer , director of the resonant and sense spinning run lola run , has turned out to be a one trick pony a maker of softheaded metaphysical claptrap
1	lrb a rrb satisfying niblet
1	this is a more fascinating look at the future than `` bladerunner '' and one of the most high concept sci fi adventures attempted for the screen
0	coupling disgracefully written dialogue with flailing bodily movements that substitute for acting , circuit is the awkwardly paced soap opera ish story
1	it rapidly develops into a gut wrenching examination of the way cultural differences and emotional expectations collide
0	you try to guess the order in which the kids in the house will be gored
1	payne has created a beautiful canvas , and nicholson proves once again that he 's the best brush in the business
0	lrb siegel rrb and co writers lisa bazadona and grace woodard have relied too much on convention in creating the characters who surround frankie
1	while the material is slight , the movie is better than you might think
0	unambitious writing emerges in the movie , using a plot that could have come from an animated movie screenwriting textbook
1	the film 's strength is n't in its details , but in the larger picture it paints of a culture in conflict with itself , with the thin veneer of nationalism that covers our deepest , media soaked fears
0	i do n't think most of the people who loved the 1989 paradiso will prefer this new version
0	a sluggish pace and lack of genuine narrative hem the movie in every bit as much as life hems in the spirits of these young women
0	broomfield 's style of journalism is hardly journalism at all , and even those with an avid interest in the subject will grow impatient
