0	this is the kind of movie where the big scene is a man shot out of a cannon into a vat of ice cream
1	both garcia and jagger turn in perfectly executed and wonderfully sympathetic characters , who are alternately touching and funny
0	many went to see the attraction for the sole reason that it was hot outside and there was air conditioning inside , and i do n't think that a c will help this movie one bit
0	you 'll trudge out of the theater feeling as though you rode the zipper after eating a corn dog and an extra large cotton candy
1	crudup 's screen presence is the one thing that holds interest in the midst of a mushy , existential exploration of why men leave their families
1	not everyone will welcome or accept the trials of henry kissinger as faithful portraiture , but few can argue that the debate it joins is a necessary and timely one
1	by surrounding us with hyper artificiality , haynes makes us see familiar issues , like racism and homophobia , in a fresh way
1	somehow manages to escape the shackles of its own clich s to be the best espionage picture to come out in weeks
1	a highly spirited , imaginative kid 's movie that broaches neo augustinian theology is god stuck in heaven because he 's afraid of his best known creation ?
1	alas , it 's the man that makes the clothes
0	when the fire burns out , we 've only come face to face with a couple dragons and that 's where the film ultimately fails
1	this often hilarious farce manages to generate the belly laughs of lowbrow comedy without sacrificing its high minded appeal
1	the pianist is polanski 's best film
1	you feel good , you feel sad , you feel pissed off , but in the end , you feel alive which is what they did
0	klein , charming in comedies like american pie and dead on in election , delivers one of the saddest action hero performances ever witnessed
1	from the dull , surreal ache of mortal awareness emerges a radiant character portrait
0	utter mush conceited pap
0	despite its hawaiian setting , the science fiction trimmings and some moments of rowdy slapstick , the basic plot of `` lilo '' could have been pulled from a tear stained vintage shirley temple script
1	gooding is the energetic frontman , and it 's hard to resist his enthusiasm , even if the filmmakers come up with nothing original in the way of slapstick sequences
0	the whole thing succeeded only in making me groggy
1	just when you think that every possible angle has been exhausted by documentarians , another new film emerges with yet another remarkable yet shockingly little known perspective
1	think of it as gidget , only with muscles and a lot more smarts , but just as endearing and easy to watch
1	grant carries the day with impeccable comic timing , raffish charm and piercing intellect
0	a frustrating ` tweener ' too slick , contrived and exploitative for the art houses and too cynical , small and decadent for the malls
0	predictably soulless techno tripe
0	the filmmakers keep pushing the jokes at the expense of character until things fall apart
1	it 's incredible the number of stories the holocaust has generated
0	the movie keeps coming back to the achingly unfunny phonce and his several silly subplots
0	the film 's most improbable feat ?
1	the charm of revolution os is rather the way it introduces you to new , fervently held ideas and fanciful thinkers
1	there is no substitute for on screen chemistry , and when friel pulls the strings that make williams sink into melancholia , the reaction in williams is as visceral as a gut punch
0	there are some fairly unsettling scenes , but they never succeed in really rattling the viewer
0	possibly the most irresponsible picture ever released by a major film studio
0	the characters are paper thin and the plot is so cliched and contrived that it makes your least favorite james bond movie seem as cleverly plotted as the usual suspects
1	a crisp psychological drama lrb and rrb a fascinating little thriller that would have been perfect for an old `` twilight zone '' episode
1	there is simply no doubt that this film asks the right questions at the right time in the history of our country
0	time stands still in more ways that one in clockstoppers , a sci fi thriller as lazy as it is interminable
1	a dark , quirky road movie that constantly defies expectation
1	mr spielberg and his company just want you to enjoy yourselves without feeling conned
0	what the audience feels is exhaustion , from watching a movie that is dark lrb dark green , to be exact rrb , sour , bloody and mean
1	mr polanski is in his element here alone , abandoned , but still consoled by his art , which is more than he has ever revealed before about the source of his spiritual survival
0	a devastating indictment of unbridled greed and materalism
0	it feels like very light errol morris , focusing on eccentricity but failing , ultimately , to make something bigger out of its scrapbook of oddballs
1	it 's full of cheesy dialogue , but great trashy fun that finally returns de palma to his pulpy thrillers of the early '80s
1	diggs and lathan are among the chief reasons brown sugar is such a sweet and sexy film
0	but this new jangle of noise , mayhem and stupidity must be a serious contender for the title
1	darkly funny and frequently insightful
1	formuliac , but fun
0	there 's some good material in their story about a retail clerk wanting more out of life , but the movie too often spins its wheels with familiar situations and repetitive scenes
1	damon brings the proper conviction to his role as lrb jason bourne rrb
0	the movie does n't generate a lot of energy
1	and yet , it still works
0	it squanders chan 's uniqueness it could even be said to squander jennifer love hewitt !
1	a light , yet engrossing piece
1	really quite funny
0	pretty much sucks , but has a funny moment or two
0	a singularly off putting romantic comedy
0	diaz wears out her welcome in her most charmless performance
0	the actors improvise and scream their way around this movie directionless , lacking any of the rollicking dark humor so necessary to make this kind of idea work on screen
1	the off center humor is a constant , and the ensemble gives it a buoyant delivery
0	nearly all the fundamentals you take for granted in most films are mishandled here
1	an eye boggling blend of psychedelic devices , special effects and backgrounds , ` spy kids 2 ' is a visual treat for all audiences
0	a lot of talent is wasted in this crass , low wattage endeavor
1	saddled with an unwieldy cast of characters and angles , but the payoff is powerful and revelatory
1	an engaging criminal romp that will have viewers guessing just who 's being conned right up to the finale
1	an engrossing portrait of uncompromising artists trying to create something original against the backdrop of a corporate music industry that only seems to care about the bottom line
0	kaufman 's script is never especially clever and often is rather pretentious
1	it celebrates the group 's playful spark of nonconformity , glancing vividly back at what hibiscus grandly called his ` angels of light '
0	like coming into a long running , well written television series where you 've missed the first half dozen episodes and probably wo n't see the next six
1	its flame like , roiling black and white inspires trembling and gratitude
1	although it includes a fair share of dumb drug jokes and predictable slapstick , `` orange county '' is far funnier than it would seem to have any right to be
1	lrb the film rrb tackles the topic of relationships in such a straightforward , emotionally honest manner that by the end , it 's impossible to ascertain whether the film is , at its core , deeply pessimistic or quietly hopeful
0	the film is weighed down by supporting characters who are either too goodly , wise and knowing or downright comically evil
0	it 's a visual rorschach test and i must have failed
1	an uncomfortable experience , but one as brave and challenging as you could possibly expect these days from american cinema
1	the huskies are beautiful , the border collie is funny and the overall feeling is genial and decent
1	charming and witty , it 's also somewhat clumsy
1	amari has dressed up this little parable in a fairly irresistible package full of privileged moments and memorable performances
0	with mcconaughey in an entirely irony free zone and bale reduced mainly to batting his sensitive eyelids , there 's not enough intelligence , wit or innovation on the screen to attract and sustain an older crowd
1	a vivid , spicy footnote to history , and a movie that grips and holds you in rapt attention from start to finish
1	an eerily suspenseful , deeply absorbing piece that works as a treatise on spirituality as well as a solid sci fi thriller
0	despite juliet stevenon 's attempt to bring cohesion to pamela 's emotional roller coaster life , it is not enough to give the film the substance it so desperately needs
1	this film is an act of spiritual faith an eloquent , deeply felt meditation on the nature of compassion
1	it all plays out like a high end john hughes comedy , a kind of elder bueller 's time out
0	what with all the blanket statements and dime store ruminations on vanity , the worries of the rich and sudden wisdom , the film becomes a sermon for most of its running time
0	wildly incompetent but brilliantly named half past dead or for seagal pessimists totally past his prime
1	those eternally devoted to the insanity of black will have an intermittently good time
0	the pretensions and disposable story sink the movie
1	she nearly glows with enthusiasm , sensuality and a conniving wit
1	and for many of us , that 's good enough
1	meyjes has done his homework and soaked up some jazzy new revisionist theories about the origins of nazi politics and aesthetics
1	poetic , heartbreaking
1	a memorable experience that , like many of his works , presents weighty issues colorfully wrapped up in his own idiosyncratic strain of kitschy goodwill
1	as an actress , madonna is one helluva singer
0	the script by vincent r nebrida tries to cram too many ingredients into one small pot
0	just as the lousy tarantino imitations have subsided , here comes the first lousy guy ritchie imitation
1	the direction has a fluid , no nonsense authority , and the performances by harris , phifer and cam ` ron seal the deal
1	a film that will enthrall the whole family
0	it just does n't have anything really interesting to say
1	much of the lady and the duke is about quiet , decisive moments between members of the cultural elite as they determine how to proceed as the world implodes
0	while you have to admit it 's semi amusing to watch robert deniro belt out `` when you 're a jet , you 're a jet all the way , '' it 's equally distasteful to watch him sing the lyrics to `` tonight ''
1	a quaint , romanticized rendering
1	filmmakers david weissman and bill weber benefit enormously from the cockettes ' camera craziness not only did they film performances , but they did the same at home
1	as chilling and fascinating as philippe mora 's modern hitler study , snide and prejudice
0	a little too ponderous to work as shallow entertainment , not remotely incisive enough to qualify as drama , monsoon wedding serves mostly to whet one 's appetite for the bollywood films
0	a movie that the less charitable might describe as a castrated cross between highlander and lolita
0	seagal , who looks more like danny aiello these days , mumbles his way through the movie
1	a full experience , a love story and a murder mystery that expands into a meditation on the deep deceptions of innocence
0	how do you make a movie with depth about a man who lacked any ?
1	fudges fact and fancy with such confidence that we feel as if we 're seeing something purer than the real thing
1	the cast is top notch and i predict there will be plenty of female audience members drooling over michael idemoto as michael
0	sandra bullock and hugh grant make a great team , but this predictable romantic comedy should get a pink slip
1	it 's all stitched together with energy , intelligence and verve , enhanced by a surplus of vintage archive footage
0	so muddled , repetitive and ragged that it says far less about the horrifying historical reality than about the filmmaker 's characteristic style
1	a faster paced family flick
0	`` analyze that '' is one of those crass , contrived sequels that not only fails on its own , but makes you second guess your affection for the original
1	fairy tale formula , serves as a paper skeleton for some very good acting , dialogue , comedy , direction and especially charm
1	the quirky drama touches the heart and the funnybone thanks to the energetic and always surprising performance by rachel griffiths
0	i 'm sure the filmmakers found this a remarkable and novel concept , but anybody who has ever seen an independent film can report that it is instead a cheap clich
1	in its understanding , often funny way , it tells a story whose restatement is validated by the changing composition of the nation
1	let 's issue a moratorium , effective immediately , on treacly films about inspirational prep school professors and the children they so heartwarmingly motivate
0	tiresomely derivative and hammily acted
1	i walked away from this new version of e t just as i hoped i would with moist eyes
0	what should have been a cutting hollywood satire is instead about as fresh as last week 's issue of variety
1	the film does a solid job of slowly , steadily building up to the climactic burst of violence
1	the heart of the film is a touching reflection on aging , suffering and the prospect of death
0	the notion of deleting emotion from people , even in an advanced prozac nation , is so insanely dysfunctional that the rampantly designed equilibrium becomes a concept doofus
1	puts to rest any thought that the german film industry can not make a delightful comedy centering on food
0	with the dog days of august upon us , think of this dog of a movie as the cinematic equivalent of high humidity
0	no amount of arty theorizing the special effects are ` german expressionist , ' according to the press notes can render it anything but laughable
1	a well executed spy thriller
0	lisa rinzler 's cinematography may be lovely , but love liza 's tale itself virtually collapses into an inhalant blackout , maintaining consciousness just long enough to achieve callow pretension
1	the trailer is a riot
0	this cloying , voices from the other side story is hell
0	alas , getting there is not even half the interest
1	a chilly , brooding but quietly resonant psychological study of domestic tension and unhappiness
1	the result is somewhat satisfying it still comes from spielberg , who has never made anything that was n't at least watchable
1	i 'll go out on a limb
1	deflated ending aside , there 's much to recommend the film
0	sheridan is painfully bad , a fourth rate jim carrey who does n't understand the difference between dumb fun and just plain dumb
1	as improbable as this premise may seem , abbass 's understated , shining performance offers us the sense that on some elemental level , lilia deeply wants to break free of her old life
0	maybe leblanc thought , `` hey , the movie about the baseball playing monkey was worse ''
1	gives an intriguing twist to the french coming of age genre
1	he nonetheless appreciates the art and reveals a music scene that transcends culture and race
1	escapes the precious trappings of most romantic comedies , infusing into the story very real , complicated emotions
0	full of bland hotels , highways , parking lots , with some glimpses of nature and family warmth , time out is a discreet moan of despair about entrapment in the maze of modern life
1	a naturally funny film , home movie makes you crave chris smith 's next movie
0	director hoffman , his writer and kline 's agent should serve detention
1	the quirky and recessive charms of co stars martin donovan and mary louise parker help overcome the problematic script
0	it 's a mindless action flick with a twist far better suited to video viewing than the multiplex
0	as an entertainment destination for the general public , kung pow sets a new benchmark for lameness
1	graced with the kind of social texture and realism that would be foreign in american teen comedies
1	lrb allen rrb manages to breathe life into this somewhat tired premise
0	the truth about charlie is that it 's a brazenly misguided project
0	with little visible talent and no energy , colin hanks is in bad need of major acting lessons and maybe a little coffee
0	this movie feel more like a non stop cry for attention , than an attempt at any kind of satisfying entertainment
1	exhilarating but blatantly biased
1	a mostly believable , refreshingly low key and quietly inspirational little sports drama
1	rarely , a movie is more than a movie
0	how this one escaped the lifetime network i 'll never know
0	to some eyes this will seem like a recycling of clich s , an assassin 's greatest hits
0	less funny than it should be and less funny than it thinks it is
0	an achingly enthralling premise , the film is hindered by uneven dialogue and plot lapses
0	the innate theatrics that provide its thrills and extreme emotions lose their luster when flattened onscreen
1	a gentle and engrossing character study
0	sluggish , tonally uneven
0	ultimately , the film amounts to being lectured to by tech geeks , if you 're up for that sort of thing
0	the film is undone by anachronistic quick edits and occasional jarring glimpses of a modern theater audience watching the events unfold
1	what could have easily become a cold , calculated exercise in postmodern pastiche winds up a powerful and deeply moving example of melodramatic moviemaking
0	russell lacks the visual panache , the comic touch , and perhaps the budget of sommers 's title bout features
1	some remarkable achival film about how shanghai lrb of all places rrb served jews who escaped the holocaust
0	`` interview '' loses its overall sense of mystery and becomes a tv episode rather than a documentary that you actually buy into
1	an old fashioned but emotionally stirring adventure tale of the kind they rarely make anymore
1	intelligent and moving
1	a bodice ripper for intellectuals
1	it 's fun , wispy , wise and surprisingly inoffensive for a film about a teen in love with his stepmom
0	the narrator and the other characters try to convince us that acting transfigures esther , but she 's never seen speaking on stage one feels cheated , and esther seems to remain an unchanged dullard
1	time out is existential drama without any of the pretension associated with the term
0	guilty of the worst sin of attributable to a movie like this it 's not scary in the slightest
1	peppering this urban study with references to norwegian folktales , villeneuve creates in maelstrom a world where the bizarre is credible and the real turns magical
1	elling builds gradually until you feel fully embraced by this gentle comedy
1	kwan is a master of shadow , quietude , and room noise , and lan yu is a disarmingly lived in movie
1	maryam is a small film , but it offers large rewards
1	ya yas everywhere will forgive the flaws and love the film
1	a stylistic romp that 's always fun to watch
0	you can tell almost immediately that welcome to collinwood is n't going to jell
1	a shimmeringly lovely coming of age portrait , shot in artful , watery tones of blue , green and brown
0	its impressive images of crematorium chimney fires and stacks of dead bodies are undermined by the movie 's presentation , which is way too stagy
0	there 's a heavy stench of ` been there , done that ' hanging over the film
1	an affectionately goofy satire that 's unafraid to throw elbows when necessary
1	but never mind all that the boobs are fantasti
0	at every opportunity to do something clever , the film goes right over the edge and kills every sense of believability all you have left is a no surprise series of explosions and violence while banderas looks like he 's not trying to laugh at how bad it
0	stress ` dumb '
1	katz 's documentary does n't have much panache , but with material this rich it does n't need it
0	deadly dull , pointless meditation on losers in a gone to seed hotel
1	huppert and girardot give performances of exceptional honesty
0	where 's the movie here ?
0	an unsophisticated sci fi drama that takes itself all too seriously
0	whether this is art imitating life or life imitating art , it 's an unhappy situation all around
0	it does n't take a rocket scientist to figure out that this is a mormon family movie , and a sappy , preachy one at that
1	this makes minority report necessary viewing for sci fi fans , as the film has some of the best special effects ever
0	if you really want to understand what this story is really all about , you 're far better served by the source material
1	swimming is above all about a young woman 's face , and by casting an actress whose face projects that woman 's doubts and yearnings , it succeeds
0	mattei 's underdeveloped effort here is nothing but a convenient conveyor belt of brooding personalities that parade about as if they were coming back from stock character camp a drowsy drama infatuated by its own pretentious self examination
0	` the war of the roses , ' trailer trash style
1	the powerpuff girls arrive on the big screen with their super powers , their super simple animation and their super dooper adorability intact
0	originality is sorely lacking
1	it trusts the story it sets out to tell
0	the film has a kind of hard , cold effect
1	strip it of all its excess debris , and you 'd have a 90 minute , four star movie
1	while there 's likely very little crossover appeal to those without much interest in the elizabethans lrb as well as rank frustration from those in the know about rubbo 's dumbed down tactics rrb , much ado about something is an amicable endeavor
0	did we really need a remake of `` charade ? ''
1	stevens has a flair for dialogue comedy , the film operates nicely off the element of surprise , and the large cast is solid
0	the mystery of enigma is how a rich historical subject , combined with so much first rate talent could have yielded such a flat , plodding picture
1	all leather pants augmented boobs , hawn is hilarious as she tries to resuscitate the fun loving libertine lost somewhere inside the conservative , handbag clutching sarandon
1	throughout , mr audiard 's direction is fluid and quick
1	the observations of this social economic urban environment are canny and spiced with irony
1	while insomnia is in many ways a conventional , even predictable remake , nolan 's penetrating undercurrent of cerebral and cinemantic flair lends lrb it rrb stimulating depth
1	undoubtedly the scariest movie ever made about tattoos
0	in the pile of useless actioners from mtv schmucks who do n't know how to tell a story for more than four minutes
0	watching a brian depalma movie is like watching an alfred hitchcock movie after drinking twelve beers
1	ian holm conquers france as an earthy napoleon
0	time out is as serious as a pink slip
0	tykwer 's surface flash is n't just a poor fit with kieslowski 's lyrical pessimism it completely contradicts everything kieslowski 's work aspired to , including the condition of art
0	lrb creates rrb the worst kind of mythologizing , the kind that sacrifices real heroism and abject suffering for melodrama
0	director tom shadyac and star kevin costner glumly mishandle the story 's promising premise of a physician who needs to heal himself
1	a tremendous piece of work
1	as an actor 's showcase , hart 's war has much to recommend it , even if the top billed willis is not the most impressive player
1	a pretty funny movie , with most of the humor coming , as before , from the incongruous but chemically perfect teaming of crystal and de niro
1	there 's something poignant about an artist of 90 plus years taking the effort to share his impressions of life and loss and time and art with us
0	our culture is headed down the toilet with the ferocity of a frozen burrito after an all night tequila bender and i know this because i 've seen ` jackass the movie '
1	moonlight mile does n't quite go the distance but the cast is impressive and they all give life to these broken characters who are trying to make their way through this tragedy
0	american and european cinema has amassed a vast holocaust literature , but it is impossible to think of any film more challenging or depressing than the grey zone
0	the script is too mainstream and the psychology too textbook to intrigue
0	if you recognize zeus lrb the dog from snatch rrb it will make you wish you were at home watching that movie instead of in the theater watching this one
1	wilco is a phenomenal band with such an engrossing story that will capture the minds and hearts of many
1	though nijinsky 's words grow increasingly disturbed , the film maintains a beguiling serenity and poise that make it accessible for a non narrative feature
0	parker updates the setting in an attempt to make the film relevant today , without fully understanding what it was that made the story relevant in the first place
1	this movie may not have the highest production values you 've ever seen , but it 's the work of an artist , one whose view of america , history and the awkwardness of human life is generous and deep
1	brings together some of the biggest names in japanese anime , with impressive results
0	woefully pretentious
0	mattei so completely loses himself to the film 's circular structure to ever offer any insightful discourse on , well , love in the time of money
1	lrb leigh rrb has a true talent for drawing wrenching performances from his actors lrb improvised over many months rrb and for conveying the way tiny acts of kindness make ordinary life survivable
0	director douglas mcgrath takes on nickleby with all the halfhearted zeal of an 8th grade boy delving into required reading
