0	like an afterschool special with costumes by gianni versace , mad love looks better than it feels
1	a strong script , powerful direction and splendid production design allows us to be transported into the life of wladyslaw szpilman , who is not only a pianist , but a good human being
1	miller tells this very compelling tale with little fuss or noise , expertly plucking tension from quiet
0	it has no affect on the kurds , but it wore me down
1	the wanton slipperiness of corpus and its amiable jerking and reshaping of physical time and space would make it a great piece to watch with kids and use to introduce video as art
1	the real star of this movie is the score , as in the songs translate well to film , and it 's really well directed
0	instead of letting the laughs come as they may , lawrence unleashes his trademark misogyny er , comedy like a human volcano or an overflowing septic tank , take your pick
0	this tuxedo should have been sent back to the tailor for some major alterations
0	ever see one of those comedies that just seem like a bad idea from frame one ?
1	the film is impressive for the sights and sounds of the wondrous beats the world has to offer
1	for most of its footage , the new thriller proves that director m night shyamalan can weave an eerie spell and that mel gibson can gasp , shudder and even tremble without losing his machismo
0	downright transparent is the script 's endless assault of embarrassingly ham fisted sex jokes that reek of a script rewrite designed to garner the film a `` cooler '' pg 13 rating
0	the performances are so overstated , the effect comes off as self parody
0	in terms of execution this movie is careless and unfocused
1	the story ultimately takes hold and grips hard
0	the whole movie is simply a lazy exercise in bad filmmaking that asks you to not only suspend your disbelief but your intelligence as well
1	it puts washington , as honest working man john q archibald , on a pedestal , then keeps lifting the pedestal higher
0	i have not been this disappointed by a movie in a long time
1	an alternately fascinating and frustrating documentary
1	a directorial tour de force by bernard rose , ivans xtc
0	unfortunately , one hour photo lives down to its title
0	for a guy who has waited three years with breathless anticipation for a new hal hartley movie to pore over , no such thing is a big letdown
1	beautifully produced
1	a compelling coming of age drama about the arduous journey of a sensitive young girl through a series of foster homes and a fierce struggle to pull free from her dangerous and domineering mother 's hold over her
1	lee 's achievement extends to his supple understanding of the role that brown played in american culture as an athlete , a movie star , and an image of black indomitability
1	it 's definitely an improvement on the first blade , since it does n't take itself so deadly seriously
1	yet this one makes up for in heart what it lacks in outright newness
0	the most memorable moment was when green threw medical equipment at a window not because it was particularly funny , but because i had a serious urge to grab the old lady at the end of my aisle 's walker and toss it at the screen in frustration
0	the premise of `` abandon '' holds promise , but its delivery is a complete mess
1	shyamalan offers copious hints along the way myriad signs , if you will that beneath the familiar , funny surface is a far bigger , far more meaningful story than one in which little green men come to earth for harvesting purposes
0	call me a cynic , but there 's something awfully deadly about any movie with a life affirming message
0	we started to wonder if some unpaid intern had just typed ` chris rock , ' ` anthony hopkins ' and ` terrorists ' into some univac like script machine
0	it 's hard to imagine that even very small children will be impressed by this tired retread
1	the art direction is often exquisite , and the anthropomorphic animal characters are beautifully realized through clever makeup design , leaving one to hope that the eventual dvd release will offer subtitles and the original italian language soundtrack
0	the problem with movies about angels is they have a tendency to slip into hokum
0	lazy filmmaking , with the director taking a hands off approach when he should have shaped the story to show us why it 's compelling
1	like smoke signals , the film is also imbued with strong themes of familial ties and spirituality that are powerful and moving without stooping to base melodrama
0	as with so many merchandised to the max movies of this type , more time appears to have gone into recruiting the right bands for the playlist and the costuming of the stars than into the script , which has a handful of smart jokes and not much else
1	the film 's images give a backbone to the company and provide an emotional edge to its ultimate demise
1	stuffed to the brim with ideas , american instigator michael moore 's film is a rambling examination of american gun culture that uses his usual modus operandi of crucifixion through juxtaposition
0	press the delete key
1	the kind of entertainment that parents love to have their kids see
1	for all its visual panache and compelling supporting characters , the heart of the film rests in the relationship between sullivan and his son
1	imamura has said that warm water under a red bridge is a poem to the enduring strengths of women
0	a grating , emaciated flick
0	it 's plotless , shapeless and yet , it must be admitted , not entirely humorless
0	with a tone as variable as the cinematography , schaeffer 's film never settles into the light footed enchantment the material needs , and the characters ' quirks and foibles never jell into charm
0	a very slow , uneventful ride around a pretty tattered old carousel
1	jackson is always watchable
1	showtime is a fine looking film with a bouncy score and a clutch of lively songs for deft punctuation
0	mib ii is a movie that makes it possible for the viewer to doze off for a few minutes or make several runs to the concession stand and or restroom and not feel as if he or she has missed anything
1	bright , intelligent , and humanly funny film
0	too bad kramer could n't make a guest appearance to liven things up
1	300 years of russian history and culture compressed into an evanescent , seamless and sumptuous stream of consciousness
0	the modern remake of dumas 's story is long on narrative and lrb too rrb short on action
0	seagal is painfully foolish in trying to hold onto what 's left of his passe ' chopsocky glory
1	the enjoyable undercover brother , a zany mix of saturday night live style parody , '70s blaxploitation films and goofball action comedy gone wild , dishes out a ton of laughs that everyone can enjoy
1	fantastic !
0	there 's not a spark of new inspiration in it , just more of the same , done with noticeably less energy and imagination
1	`` red dragon '' is entertaining
0	hoffman waits too long to turn his movie in an unexpected direction , and even then his tone retains a genteel , prep school quality that feels dusty and leatherbound
1	secretary is just too original to be ignored
1	while cherish does n't completely survive its tonal transformation from dark comedy to suspense thriller , it 's got just enough charm and appealing character quirks to forgive that still serious problem
0	the lack of naturalness makes everything seem self consciously poetic and forced it 's a pity that lrb nelson 's rrb achievement does n't match his ambition
1	graham greene 's novel of colonialism and empire is elevated by michael caine 's performance as a weary journalist in a changing world
0	the movie is so resolutely cobbled together out of older movies that it even uses a totally unnecessary prologue , just because it seems obligatory
1	my big fat greek wedding is not only the best date movie of the year , it 's also a dare i say it twice delightfully charming and totally american , i might add slice of comedic bliss
1	an off beat and fanciful film about the human need for monsters to blame for all that is amiss in the world
0	this thing works on no level whatsoever for me
0	a selection of scenes in search of a movie
1	one of the most gloriously unsubtle and adrenalized extreme shockers since the evil dead
0	we do get the distinct impression that this franchise is drawing to a close
0	an unholy mess , driven by the pathetic idea that if you shoot something on crummy looking videotape , it must be labelled ` hip ' , ` innovative ' and ` realistic '
0	in the end , the weight of water comes to resemble the kind of soft core twaddle you 'd expect to see on showtime 's ` red shoe diaries '
1	meticulously uncovers a trail of outrageous force and craven concealment
1	even if the ring has a familiar ring , it 's still unusually crafty and intelligent for hollywood horror
1	time is a beautiful film to watch , an interesting and at times captivating take on loss and loneliness
1	a moving and weighty depiction of one family 's attempts to heal after the death of a child
0	it 's replaced by some dramatic scenes that are jarring and deeply out of place in what could have lrb and probably should have rrb been a lighthearted comedy
1	even if you do n't understand what on earth is going on , this is a movie that will stimulate hours of post viewing discussion , if only to be reminded of who did what to whom and why
0	watching it was painful
1	mostly honest , this somber picture reveals itself slowly , intelligently , artfully
1	the story line may be 127 years old , but el crimen del padre amaro could n't be more timely in its despairing vision of corruption within the catholic establishment
0	wait to see it then
0	unless there are zoning ordinances to protect your community from the dullest science fiction , impostor is opening today at a theater near you
1	does a good job of establishing a time and place , and of telling a fascinating character 's story
0	it 's supposed to be a romantic comedy it suffers from too much norma rae and not enough pretty woman
0	tries to work in the same vein as the brilliance of animal house but instead comes closer to the failure of the third revenge of the nerds sequel
1	for those who pride themselves on sophisticated , discerning taste , this might not seem like the proper cup of tea , however it is almost guaranteed that even the stuffiest cinema goers will laugh their off for an hour and a half
1	a film with contemporary political resonance illustrated by a winning family story
0	disney again ransacks its archives for a quick buck sequel
0	payami tries to raise some serious issues about iran 's electoral process , but the result is a film that 's about as subtle as a party political broadcast
0	one of the most incoherent features in recent memory
1	a wry , affectionate delight
1	brosnan gives a portrayal as solid and as perfect as his outstanding performance as bond in die another day
0	the problem with the mayhem in formula 51 is not that it 's offensive , but that it 's boring
1	a three hour cinema master class
1	a quirky comedy set in newfoundland that cleverly captures the dry wit that 's so prevalent on the rock
1	may not be a breakthrough in filmmaking , but it is unwavering and arresting
1	caruso sometimes descends into sub tarantino cuteness but for the most part he makes sure the salton sea works the way a good noir should , keeping it tight and nasty
0	the rest of the film is dudsville
1	brutally honest and told with humor and poignancy , which makes its message resonate
1	a good film that must have baffled the folks in the marketing department
0	director uwe boll and writer robert dean klein fail to generate any interest in an unsympathetic hero caught up in an intricate plot that while cleverly worked out , can not overcome blah characters
0	the metaphors are provocative , but too often , the viewer is left puzzled by the mechanics of the delivery
0	works better in the conception than it does in the execution winds up seeming just a little too clever
1	wonderful fencing scenes and an exciting plot make this an eminently engrossing film
1	a bold lrb and lovely rrb experiment that will almost certainly bore most audiences into their own brightly colored dreams
1	a wonderfully warm human drama that remains vividly in memory long after viewing
0	if any of them list this ` credit ' on their resumes in the future , that 'll be much funnier than anything in the film
0	after you laugh once lrb maybe twice rrb , you will have completely forgotten the movie by the time you get back to your car in the parking lot
0	the hanukkah spirit seems fried in pork
1	there are plenty of scenes in frida that do work , but rarely do they involve the title character herself
1	it is scott 's convincing portrayal of roger the sad cad that really gives the film its oomph
1	4ever has the same sledgehammer appeal as pokemon videos , but it breathes more on the big screen and induces headaches more slowly
1	a chilling tale of one of the great crimes of 20th century france the murder of two rich women by their servants in 1933
0	despite all the closed door hanky panky , the film is essentially juiceless
0	it 's one long bore
0	if you are curious to see the darker side of what 's going on with young tv actors lrb dawson leery did what ?!? rrb , or see some interesting storytelling devices , you might want to check it out , but there 's nothing very attractive about this movie
1	it has a dashing and resourceful hero a lisping , reptilian villain big fights big hair lavish period scenery and a story just complicated enough to let you bask in your own cleverness as you figure it out
0	none of this is very original , and it is n't particularly funny
1	ice age wo n't drop your jaw , but it will warm your heart , and i 'm giving it a strong thumbs up
1	a tasty masala
1	but it does have one saving grace
1	one ca n't deny its seriousness and quality
1	piccoli gives a superb performance full of deep feeling
1	it 'll keep you wide awake and very tense
0	an empty , purposeless exercise
0	too bad
1	rich in shadowy metaphor and as sharp as a samurai sword , jiang wen 's devils on the doorstep is a wartime farce in the alternately comic and gut wrenching style of joseph heller or kurt vonnegut
0	can be classified as one of those ` alternate reality ' movies except that it would have worked so much better dealing in only one reality
0	despite some strong performances , never rises above the level of a telanovela
0	painfully padded
0	the sum of all fears is remarkably fuddled about motives and context , which drains it of the dramatic substance that would shake us in our boots lrb or cinema seats rrb
1	a diverse and astonishingly articulate cast of palestinian and israeli children
1	highly recommended viewing for its courage , ideas , technical proficiency and great acting
1	none of this is meaningful or memorable , but frosting is n't , either , and you would n't turn down a big bowl of that , would you ?
1	a gripping documentary that reveals how deep the antagonism lies in war torn jerusalem
1	i had a dream that a smart comedy would come along to rescue me from a summer of teen driven , toilet humor codswallop , and its name was earnest
1	a delightful surprise because despite all the backstage drama , this is a movie that tells stories that work is charming , is moving , is funny and looks professional
1	for all the wit and hoopla , festival in cannes offers rare insight into the structure of relationships
0	every joke is repeated at least annoying , is n't it ?
1	` anyone with a passion for cinema , and indeed sex , should see it as soon as possible '
1	a refreshing change from the usual whoopee cushion effort aimed at the youth market
1	an interesting slice of history
0	for dance completists only
0	it has the air of a surprisingly juvenile lark , a pop influenced prank whose charms are immediately apparent and wear thin with repetition
0	it 's uninteresting
0	bray is completely at sea with nothing but a savage garden music video on his resume , he has no clue about making a movie
1	a tone poem of transgression
0	seemingly a vehicle to showcase the canadian 's inane ramblings , stealing harvard is a smorgasbord of soliloquies about nothing delivered by the former mr drew barrymore
0	confusion is one of my least favourite emotions , especially when i have to put up with 146 minutes of it
1	road to perdition does display greatness , and it 's worth seeing
0	ultimately , sarah 's dedication to finding her husband seems more psychotic than romantic , and nothing in the movie makes a convincing case that one woman 's broken heart outweighs all the loss we witness
1	an intense and effective film about loneliness and the chilly anonymity of the environments where so many of us spend so much of our time
0	one of the worst movies of the year
0	like a soft drink that 's been sitting open too long it 's too much syrup and not enough fizz
0	too bad writer director adam rifkin situates it all in a plot as musty as one of the golden eagle 's carpets
0	it has more in common with a fireworks display than a movie , which normally is expected to have characters and a storyline
1	a captivatingly quirky hybrid of character portrait , romantic comedy and beat the clock thriller
1	manages to delight without much of a story
0	an hour and a half of inoffensive , unmemorable filler
1	may take its sweet time to get wherever it 's going , but if you have the patience for it , you wo n't feel like it 's wasted yours
0	ultimately , the film never recovers from the clumsy clich of the ugly american abroad , and the too frosty exterior ms paltrow employs to authenticate her british persona is another liability
0	in the book on tape market , the film of `` the kid stays in the picture '' would be an abridged edition
0	it is bad , but certainly not without merit as entertainment
0	high crimes is a cinematic misdemeanor , a routine crime thriller remarkable only for its lack of logic and misuse of two fine actors , morgan freeman and ashley judd
0	the project 's filmmakers forgot to include anything even halfway scary as they poorly rejigger fatal attraction into a high school setting
1	a high spirited buddy movie about the reunion of berlin anarchists who face arrest 15 years after their crime
1	one of the most entertaining monster movies in ages
1	an infinitely wittier version of the home alone formula
0	devoid of any of the qualities that made the first film so special
1	succeeds where its recent predecessor miserably fails because it demands that you suffer the dreadfulness of war from both sides
1	fontaine masterfully creates a portrait of two strong men in conflict , inextricably entwined through family history , each seeing himself in the other , neither liking what he sees
1	everyone 's insecure in lovely and amazing , a poignant and wryly amusing film about mothers , daughters and their relationships
0	seemingly disgusted with the lazy material and the finished product 's unshapely look , director fisher stevens inexplicably dips key moments from the film in waking life water colors
0	it 's also curious to note that this film , like the similarly ill timed antitrust , is easily as bad at a fraction the budget
0	do n't let the subtitles fool you the movie only proves that hollywood no longer has a monopoly on mindless action
0	the only type of lives this glossy comedy drama resembles are ones in formulaic mainstream movies
1	fulford wierzbicki deftly captures the wise beyond her years teen
0	you see the movie and you think , zzzzzzzzz
1	much of this slick and sprightly cgi feature is sufficiently funny to amuse even the most resolutely unreligious parents who escort their little ones to megaplex screenings
1	a tightly directed , highly professional film that 's old fashioned in all the best possible ways
1	confessions is without a doubt a memorable directorial debut from king hunk
1	best enjoyed as a work of fiction inspired by real life events
0	this is a heartfelt story it just is n't a very involving one
1	schnitzler does a fine job contrasting the sleekness of the film 's present with the playful paranoia of the film 's past '
1	george clooney , in his first directorial effort , presents this utterly ridiculous shaggy dog story as one of the most creative , energetic and original comedies to hit the screen in years
0	` martin lawrence live ' is so self pitying , i almost expected there to be a collection taken for the comedian at the end of the show
0	the screenplay does too much meandering , norton has to recite bland police procedural details , fiennes wanders around in an attempt to seem weird and distanced , hopkins looks like a drag queen
0	if oscar had a category called best bad film you thought was going to be really awful but was n't , guys would probably be duking it out with the queen of the damned for the honor
0	anyone else who may , for whatever reason , be thinking about going to see this movie is hereby given fair warning
0	i could n't help but feel the wasted potential of this slapstick comedy
0	the latest vapid actor 's exercise to appropriate the structure of arthur schnitzler 's reigen
1	majidi 's direction has never been smoother or more confident
0	there 's only one way to kill michael myers for good stop buying tickets to these movies
1	fear permeates the whole of stortelling , todd solondz ' oftentimes funny , yet ultimately cowardly autocritique
0	falsehoods pile up , undermining the movie 's reality and stifling its creator 's comic voice
0	bland but harmless
0	like leafing through an album of photos accompanied by the sketchiest of captions
0	judd 's characters ought to pick up the durable best seller smart women , foolish choices for advice
0	the criticism never rises above easy , cynical potshots at morally bankrupt characters
1	adolescents will be adequately served by the movie 's sophomoric blend of shenanigans and slapstick , although the more lascivious minded might be disappointed in the relative modesty of a movie that sports a ` topless tutorial service '
1	about the best thing you could say about narc is that it 's a rock solid little genre picture
0	an unbelievably stupid film , though occasionally fun enough to make you forget its absurdity
1	star producer salma hayek and director julie taymor have infused frida with a visual style unique and inherent to the titular character 's paintings and in the process created a masterful work of art of their own
1	what lrb denis rrb accomplishes in his chilling , unnerving film is a double portrait of two young women whose lives were as claustrophic , suffocating and chilly as the attics to which they were inevitably consigned
0	to build a feel good fantasy around a vain dictator madman is off putting , to say the least , not to mention inappropriate and wildly undeserved
0	a generic bloodbath that often becomes laughably unbearable when it is n't merely offensive
1	judith and zaza 's extended bedroom sequence is so intimate and sensual and funny and psychologically self revealing that it makes most of what passes for sex in the movies look like cheap hysterics
1	with an unusual protagonist lrb a kilt wearing jackson rrb and subject matter , the improbable `` formula 51 '' is somewhat entertaining , but it could have been much stronger
0	this is the kind of movie during which you want to bang your head on the seat in front of you , at its cluelessness , at its idiocy , at its utterly misplaced earnestness
0	its appeal will probably limited to lds church members and undemanding armchair tourists
0	the latest adam sandler assault and possibly the worst film of the year
1	the determination of pinochet 's victims to seek justice , and their often heartbreaking testimony , spoken directly into director patricio guzman 's camera , pack a powerful emotional wallop
1	a beautiful , timeless and universal tale of heated passions jealousy , betrayal , forgiveness and murder
0	hill looks to be going through the motions , beginning with the pale script
1	who needs mind bending drugs when they can see this , the final part of the ` qatsi ' trilogy , directed by godfrey reggio , with music by philip glass ?
0	disjointed parody
0	typical anim , with cheapo animation lrb like saturday morning tv in the '60s rrb , a complex sword and sorcery plot and characters who all have big round eyes and japanese names
0	you ca n't believe anyone would really buy this stuff
0	the plot is nothing but boilerplate clich s from start to finish , and the script assumes that not only would subtlety be lost on the target audience , but that it 's also too stupid to realize that they 've already seen this exact same movie a hundred times
1	twenty years later , e t is still a cinematic touchstone
1	angela gheorghiu as famous prima donna floria tosca , roberto alagna as her lover mario cavaradossi , and ruggero as the villainous , lecherous police chief scarpia , all sing beautifully and act adequately
1	gondry 's direction is adequate but what gives human nature its unique feel is kaufman 's script
0	though this rude and crude film does deliver a few gut busting laughs , its digs at modern society are all things we 've seen before
1	one of the most exciting action films to come out of china in recent years
0	glizty but formulaic and silly cagney 's ` top of the world ' has been replaced by the bottom of the barrel
0	makes a joke out of car chases for an hour and then gives us half an hour of car chases
0	lrb a rrb soulless , stupid sequel
1	with a large cast representing a broad cross section , tavernier 's film bounds along with the rat a tat energy of `` his girl friday , '' maintaining a light touch while tackling serious themes
1	unpretentious , charming , quirky , original
0	humorless , self conscious art drivel , made without a glimmer of intelligence or invention
1	told just proficiently enough to trounce its overly comfortable trappings
